{
  "id": "language-learning-landing-hero",
  "mechanism_id": "ZE-07",
  "term": "Language-learning landing hero",
  "description_as_reported": "The archived landing interface identifies Duolingo as a free language-learning product and names the supported languages.",
  "artifact_context": [
    "landing_hero"
  ],
  "provenance": [
    {
      "corpus_kind": "realization",
      "mechanism_id": "ZE-07",
      "corpus_record_id": "rr_d6d2a2a98095047fc3acc42a",
      "source_id": "wayback-cdx",
      "title": "duolingo.com interface — 2015-01-01 Wayback capture",
      "quote_or_locus": "Duolingo | Learn Spanish, French, German, Portuguese, Italian and English for free",
      "contributed_by": null
    }
  ],
  "confidence": 0.55
}
